id	date	milestone	description	num_envs	max_steps	duration_min	fps	best_reward	mean_reward_final	vram_gb	status	decision	notes
000	2026-04-11	M1	env_bootstrap	-	-	15	-	-	-	-	success	KEEP	pixi+pip Isaac Lab 2.3.2 on RTX 5090
001	2026-04-11	M1	grasp_cache_gen	16384	-	19	-	-	-	13.0	success	KEEP	50k grasps collected; scale_range=[0.5,0.5,1]
002	2026-04-11	M1	smoke_test_ppo	1024	100000	0.5	8150	2.69	-4.07	3.7	success	KEEP	fixed import_gym + termcolor + device mismatch
003	2026-04-11	M1	full_ppo_training	16384	300000000	91	54979	1130.05	1088.09	12.5	success	KEEP	300M steps; checkpoints at logs/debug/2026-04-11_21-50-19/stage1_nn/
004	2026-04-12	M1	eval_ours_stage1	256	-	0.7	-	1327.56	1272.79	3.2	success	KEEP	256 ep; 99.6% full-ep rate; median 1288.75
005	2026-04-12	M1	eval_pretrained_stage2	256	-	0.7	-	1168.48	1040.63	3.2	success	KEEP	256 ep; 100% full-ep rate; ProprioAdapt checkpoint
006	2026-04-12	M1	distill_stage2	16384	32000000	22	55600	992.39	970.25	12.8	success	KEEP	killed at 32M (plateau); stage2_nn/best.pth; trained mean 970, best 992
007	2026-04-12	M1	eval_ours_stage2	256	-	0.7	-	1221.92	1137.66	3.2	success	KEEP	256 ep; 100% full-ep rate; BEATS pretrained by 9.3%
008	2026-04-12	M1	grasp_cache_multiscale	16384	-	20	-	-	-	13.2	success	KEEP	50k grasps across 8 scales [0.4..0.6]; took longer than single-scale because harder to stabilize
009	2026-04-12	M1	full_ppo_multiscale	16384	300000000	94	51989	850.81	806.28	12.5	success	KEEP	300M steps multi-scale; ~25% lower reward than single-scale (harder task); logs/debug/2026-04-12_00-51-05
010	2026-04-12	M1	distill_stage2_multiscale	16384	1000000000	310	53795	190.33	186.34	12.5	partial	KEEP	--max_agent_steps ignored by ProprioAdapt; ran full 1e9 hardcoded; plateau at ~186 training (multi-scale distill much harder than single-scale)
011a	2026-04-12	M1	eval_ours_ms_stage1	256	-	0.7	-	1170.19	1064.64	3.2	success	KEEP	98.8% full-ep; beats pretrained stage-2
011b	2026-04-12	M1	eval_pretrained_ms	256	-	0.7	-	1188.03	950.38	3.2	success	KEEP	90.6% full-ep; baseline for multi-scale
011c	2026-04-12	M1	eval_ours_ms_stage2	256	-	0.7	-	1085.35	878.10	3.2	success	KEEP	92.2% full-ep; distill-gap visible vs pretrained (878 vs 950); higher stability (min 2.6 vs -4.4)
012	2026-04-12	M2	full_ppo_priv9_multiscale	16384	300000000	94	51866	996.09	979.17	12.5	success	KEEP	scale-aware priv_info (dim 9); +17% best +21% mean vs EXP-009; logs/debug/2026-04-12_16-12-33
013	2026-04-12	M2	distill_priv9_multiscale	16384	100000000	31	54632	810.51	768.92	12.5	success	KEEP	--max_agent_steps now works; loss 0.33→0.04; converges to ~800 vs EXP-010 stuck at 190
014	2026-04-12	M2	eval_priv9_stage2_multiscale	256	-	0.7	-	1197.04	1031.46	3.2	success	KEEP	96.5% full-ep; BEATS pretrained (950.38) by +8.5%; CLOSES the M1 multi-scale gap
015	2026-04-12	M3	xhand_urdf_unpack	-	-	5	-	-	-	-	success	KEEP	URDF v1.3 unpacked; 12 DOF, 13 joints verified
016	2026-04-12	M3	handspec_refactor	-	-	30	-	-	-	-	success	KEEP	contact_sensor_body_names, num_hand_materials, elastomer_material_ids fields added
017	2026-04-12	M3	xhand_urdf_to_usd	-	-	10	-	-	-	-	success	KEEP	merge_fixed_joints=False to preserve tip links as rigid bodies
018	2026-04-12	M3	vlm_diagnostic_pipeline	-	-	20	-	-	-	-	success	KEEP	Gemini Pro visual check harness; calibrated vs SharpaWave ground truth
019	2026-04-12	M3	xhand_pose_iter1_4	-	-	60	-	-	-	-	success	KEEP	VLM-guided init pose iterations; 4 rounds; best: iter3 4-finger wrap
022	2026-04-13	M3	xhand_grasp_gen_fail	256	-	45	-	-	-	-	fail	REVERT	cond2 (contact forces) always 0; cylinder escapes xhand's flat-cup cage
022h	2026-04-13	M3	xhand_grasp_gen_iter3pose	256	-	5	-	-	-	-	fail	REVERT	iter3 wrap pose in real physics: thumb tucks under palm, 4 fingers drift
022i	2026-04-13	M3	xhand_pd_gains_20	256	-	3	-	-	-	-	fail	REVERT	explicit stiffness=20 didn't help — root cause is cage geometry not PD
022j	2026-04-13	M3	xhand_synth_cache	-	-	1	-	-	-	-	success	KEEP	50k perturbed-pose synthetic cache generated; bypasses broken grasp gen
023	2026-04-13	M3	xhand_ppo_synth_cache	4096	3000000	15	4850	-3206.78	-3230	8.0	fail	BLOCKED	flat reward at -3200; synth cache not a real grasp so cylinder drops immediately, no rotation reward signal. M3 blocked on grasp cage — see roadmap/M3_xhand_sim.md
024	2026-04-13	M3	xhand_grasp_iter_pinch	256	-	30	-	-	-	-	fail	REVERT	8 pose iterations side-pinch; cylinder bouncing; cond2=0
025	2026-04-13	M3	xhand_grasp_palmup	256	-	15	-	-	-	-	fail	REVERT	palm-up rotation gives finger cluster; need root-curl-tip-flat
026	2026-04-14	M3	xhand_grasp_sidepinch	1024	-	10	-	-	-	-	partial	KEEP	root-curl-tip-flat + side-pinch reaches cond2=12-20/1024 but never 400 consecutive
027	2026-04-14	M3	xhand_grasp_highfric	1024	-	5	-	-	-	-	partial	KEEP	friction 0.8→5.0 boosts force max to 87N; cond2 still 9-14/1024
028	2026-04-14	M3	xhand_grasp_incremental	1024	-	22	-	-	-	-	success	KEEP	incremental cond-true cache save bypasses 400-step requirement; 50k cache filled in 22 min
029	2026-04-14	M3	xhand_ppo_real_smoke	1024	1000000	2	9100	-8576	-9000	8.0	fail	REVERT	high contact forces from real cache → -8500 reward; lowered work_pen to -0.1, torque_pen to -0.02
029b	2026-04-14	M3	xhand_ppo_lowpen	1024	2000000	2	9100	-1727	-1832	8.0	partial	KEEP	reduced penalties → -1727 best (5x improvement); slow improvement, not converging fast
030	2026-04-14	M3	xhand_sphere_grasp	1024	-	22	-	-	-	-	success	KEEP	sphere r=50mm with side-pinch pose; 50k cache filled in 22 min via incremental save
031	2026-04-14	M3	xhand_sphere_ppo_default	4096	48000000	45	18000	-968	-1000	8.5	plateau	KEEP	plateau ~-1000 over 48M steps; lower penalty needed
031b	2026-04-14	M3	xhand_sphere_ppo_lowpen	4096	48000000	45	18000	-968	-1040	8.5	plateau	KEEP	cut all penalties 1/10; reached -978 best, plateau ~-1040
031c	2026-04-14	M3	xhand_sphere_ppo_bigreward	4096	16000000	14	18000	-996	-1066	8.5	plateau	KEEP	100x boost on object_pos_reward; no breakthrough; cache poses too unstable
032	2026-04-14	M3	xhand_sphere_streak10	4096	-	30	-	-	-	-	fail	REVERT	streak=10 too strict; 0 cache entries in 30 min
032b	2026-04-14	M3	xhand_sphere_streak3	4096	-	-	-	-	-	-	abort	-	switched to target=20k mid-run
032c	2026-04-14	M3	xhand_sphere_streak3_20k	4096	-	195	-	-	-	-	success	KEEP	stable 20k cache, streak filter for ≥3 consecutive cond-true steps
033	2026-04-14	M3	xhand_sphere_ppo_streak3	4096	10000000	9	18000	-1013	-1100	8.5	plateau	KEEP	streak filter alone didn't unlock learning; same -1000 plateau
034	2026-04-14	M3	xhand_no_early_reset	4096	51000000	16	55000	0	-69000	8.5	fail	REVERT	disabled height_reset; agent can't recover from drops; -68k mean
